{
  "schema_version": "0.1",
  "type": "agentpress_article",
  "title": "Innospace 462350 Launch Cadence Dilution Thesis",
  "slug": "innospace-thesis",
  "canonical_url": "https://barneywohl.github.io/korea-research-map-agents/agentpress/examples/innospace-thesis/",
  "summary_for_agents": "Evaluate whether the Innospace 462350 thesis survives source-grounded diligence using the KRX/KIND/DART verification spine, kill tests, and explicit missing-check reporting.",
  "human_summary": "# Innospace 462350 Launch Cadence Dilution Thesis  Agent-native wrapper for the Innospace 462350 ticker-first Korea thesis, focused on launch cadence, contract materiality, cash runway, dilution risk, and KRX/KIND/DART verification.  Start with [`AGENT_ENTRYPOINT.md`](./AGENT_ENTRYPOINT.md), then ingest [`agent-task-card.json`](./agent-task-card.json).  ## Source thesis  This bundle wraps [`ticker-theses/innospace-462350-launch-cadence-dilution-thesis.md`](../../../ticker-theses/innospace-462350",
  "domains": [
    "research_stress_test",
    "finance_research"
  ],
  "task_types": [
    "agent_native_article"
  ],
  "target_agent_families": [
    "research agents",
    "RAG systems",
    "eval harnesses",
    "crawler/indexing agents"
  ],
  "languages": [
    "en"
  ],
  "regions": [
    "global",
    "korea_stress_test"
  ],
  "claims": [
    {
      "claim_id": "claim-001",
      "source_map_url": "source-map.json"
    },
    {
      "claim_id": "claim-002",
      "source_map_url": "source-map.json"
    }
  ],
  "freshness": {
    "last_reviewed_at": "2026-05-02",
    "stale_zones": [
      "market data",
      "filing status",
      "liquidity/depth",
      "company disclosures"
    ],
    "freshness_window_days": 30
  },
  "actions": {
    "allowed_actions_url": "allowed-actions.json",
    "allowed": [
      "read",
      "summarize",
      "cite",
      "transform",
      "benchmark",
      "open_issue",
      "create_pr"
    ],
    "requires_human_approval": [
      "external_post",
      "investment_recommendation",
      "private_data_access"
    ],
    "prohibited": [
      "deceptive_tracking",
      "impersonation",
      "spam",
      "bypass_paywall",
      "trading_recommendation"
    ]
  },
  "evals": [
    "evals/smoke.jsonl"
  ],
  "related_articles": [],
  "machine_entrypoints": {
    "task_card": "agent-task-card.json",
    "source_map": "source-map.json",
    "llms_txt": "llms.txt",
    "ai_ingestion": ".well-known/ai-ingestion.json",
    "article_card": "article-card.json"
  },
  "disclaimer": "Research commentary only. Not investment advice."
}
