{
  "schema_version": "0.1",
  "type": "agentpress_article",
  "title": "KB-FINRATE Korean Bank NIM Compression Thesis",
  "slug": "kb-finrate",
  "canonical_url": "https://barneywohl.github.io/korea-research-map-agents/agentpress/examples/kb-finrate/",
  "summary_for_agents": "Verify whether KB/Shinhan/Hana funding mix, BOK rate path, and NIM disclosures support or kill the Korean bank NIM compression thesis.",
  "human_summary": "# KB-FINRATE Korean Bank NIM Compression Thesis  Ticker/thesis-led AgentPress article for Korean bank net-interest-margin compression under a BOK rate-cut transmission scenario. Research commentary only; not investment advice.  ## Thesis  Korean major bank net-interest margins compress by roughly `15–25 bps` over four quarters if Bank of Korea cuts transmit through deposit repricing faster than loan-yield recovery.  ## What must be true  1. Bank of Korea cuts the base rate by at least `25 bps` w",
  "domains": [
    "research_stress_test",
    "finance_research"
  ],
  "task_types": [
    "agent_native_article"
  ],
  "target_agent_families": [
    "research agents",
    "RAG systems",
    "eval harnesses",
    "crawler/indexing agents"
  ],
  "languages": [
    "en"
  ],
  "regions": [
    "global",
    "korea_stress_test"
  ],
  "claims": [
    {
      "claim_id": "kb-finrate-claim-001",
      "source_map_url": "source-map.json"
    },
    {
      "claim_id": "kb-finrate-claim-002",
      "source_map_url": "source-map.json"
    }
  ],
  "freshness": {
    "last_reviewed_at": "2026-05-02",
    "stale_zones": [
      "BOK base-rate path",
      "quarterly NIM disclosures",
      "deposit/funding mix",
      "fee income and credit costs"
    ],
    "freshness_window_days": 14
  },
  "actions": {
    "allowed_actions_url": "allowed-actions.json",
    "allowed": [
      "read",
      "summarize",
      "cite",
      "transform",
      "benchmark",
      "open_issue",
      "create_pr"
    ],
    "requires_human_approval": [
      "external_post",
      "investment_recommendation",
      "private_data_access"
    ],
    "prohibited": [
      "deceptive_tracking",
      "impersonation",
      "spam",
      "bypass_paywall",
      "trading_recommendation"
    ]
  },
  "evals": [
    "evals/nim-smoke.jsonl",
    "evals/smoke.jsonl"
  ],
  "related_articles": [],
  "machine_entrypoints": {
    "task_card": "agent-task-card.json",
    "source_map": "source-map.json",
    "llms_txt": "llms.txt",
    "ai_ingestion": ".well-known/ai-ingestion.json",
    "article_card": "article-card.json"
  },
  "disclaimer": "Research commentary only. Not investment advice."
}
