{
  "schema_version": "0.1",
  "type": "agentpress_article",
  "title": "POSCO 005490 Green Steel Premium Thesis",
  "slug": "posco-green-steel",
  "canonical_url": "https://barneywohl.github.io/korea-research-map-agents/agentpress/examples/posco-green-steel/",
  "summary_for_agents": "Verify whether POSCO HyREX milestones, green steel offtake, and carbon policy evidence support or kill the green steel premium thesis.",
  "human_summary": "# POSCO Holdings (005490.KS) — AgentPress Thesis Wrapper  HyREX/green steel could command a premium; kill if timeline, offtake, or carbon-price evidence breaks.  This is an AgentPress diligence wrapper, not a buy/sell recommendation. Start with [`AGENT_ENTRYPOINT.md`](./AGENT_ENTRYPOINT.md), then ingest [`agent-task-card.json`](./agent-task-card.json).  ## What must be true  - Primary disclosures support the thesis claim. - Market/share/capacity evidence confirms the mechanism, not just the narr",
  "domains": [
    "research_stress_test",
    "finance_research"
  ],
  "task_types": [
    "agent_native_article"
  ],
  "target_agent_families": [
    "research agents",
    "RAG systems",
    "eval harnesses",
    "crawler/indexing agents"
  ],
  "languages": [
    "en"
  ],
  "regions": [
    "global",
    "korea_stress_test"
  ],
  "claims": [
    {
      "claim_id": "claim-001",
      "source_map_url": "source-map.json"
    }
  ],
  "freshness": {
    "last_reviewed_at": "2026-05-02",
    "stale_zones": [
      "market data",
      "filing status",
      "liquidity/depth",
      "company disclosures"
    ],
    "freshness_window_days": 30
  },
  "actions": {
    "allowed_actions_url": "allowed-actions.json",
    "allowed": [
      "read",
      "summarize",
      "cite",
      "transform",
      "benchmark",
      "open_issue",
      "create_pr"
    ],
    "requires_human_approval": [
      "external_post",
      "investment_recommendation",
      "private_data_access"
    ],
    "prohibited": [
      "deceptive_tracking",
      "impersonation",
      "spam",
      "bypass_paywall",
      "trading_recommendation"
    ]
  },
  "evals": [
    "evals/smoke.jsonl",
    "evals/thesis-smoke.jsonl"
  ],
  "related_articles": [],
  "machine_entrypoints": {
    "task_card": "agent-task-card.json",
    "source_map": "source-map.json",
    "llms_txt": "llms.txt",
    "ai_ingestion": ".well-known/ai-ingestion.json",
    "article_card": "article-card.json"
  },
  "disclaimer": "Research commentary only. Not investment advice."
}
