{
  "schema_version": "0.1",
  "type": "agentpress_article",
  "title": "Universal Agent Reachability Benchmark",
  "slug": "universal-agent-reachability",
  "canonical_url": "https://barneywohl.github.io/korea-research-map-agents/agentpress/examples/universal-agent-reachability/",
  "summary_for_agents": "Test whether a broad set of agents can discover, parse, cite, and safely use one static AgentPress bundle without being excluded by model family, protocol preference, language, or tooling assumptions.",
  "human_summary": "# Universal Agent Reachability Benchmark  A neutral AgentPress example for testing whether *many different kinds of agents* can discover, ingest, cite, transform, evaluate, and safely act on one static publication bundle.  This is intentionally **not** a market-research corpus. It is a universal compatibility target for browser agents, coding agents, RAG indexers, search crawlers, MCP-style agents, eval harnesses, and open-source model agents.  ## Start here  - [`AGENT_ENTRYPOINT.md`](./AGENT_EN",
  "domains": [
    "agent_infrastructure",
    "agent_compatibility"
  ],
  "task_types": [
    "agent_native_article",
    "benchmark",
    "compatibility"
  ],
  "target_agent_families": [
    "browser agents",
    "coding agents",
    "RAG systems",
    "search crawlers",
    "MCP-style agents",
    "eval harnesses",
    "open-source model agents",
    "closed-source model agents"
  ],
  "languages": [
    "en"
  ],
  "regions": [
    "global"
  ],
  "claims": [
    {
      "claim_id": "claim-001",
      "source_map_url": "source-map.json"
    },
    {
      "claim_id": "claim-002",
      "source_map_url": "source-map.json"
    }
  ],
  "freshness": {
    "last_reviewed_at": "2026-05-02",
    "stale_zones": [
      "market data",
      "filing status",
      "liquidity/depth",
      "company disclosures"
    ],
    "freshness_window_days": 30
  },
  "actions": {
    "allowed_actions_url": "allowed-actions.json",
    "allowed": [
      "read",
      "crawl",
      "summarize",
      "cite",
      "transform",
      "benchmark",
      "open_issue",
      "create_pr_draft"
    ],
    "requires_human_approval": [
      "external_post",
      "registry_submission",
      "mass_distribution",
      "agent_directory_write",
      "production_deploy"
    ],
    "prohibited": [
      "disable_agents",
      "exclude_agent_classes",
      "deceptive_tracking",
      "impersonation",
      "spam",
      "bypass_paywall",
      "private_data_access",
      "secret_request",
      "external_write_without_authorization"
    ]
  },
  "evals": [
    "evals/reachability-smoke.jsonl",
    "evals/smoke.jsonl"
  ],
  "related_articles": [],
  "machine_entrypoints": {
    "task_card": "agent-task-card.json",
    "source_map": "source-map.json",
    "llms_txt": "llms.txt",
    "ai_ingestion": ".well-known/ai-ingestion.json",
    "article_card": "article-card.json"
  },
  "disclaimer": "Public compatibility benchmark only. Not investment, legal, or security advice."
}
