{
  "schema_version": "0.1",
  "type": "agentpress_article",
  "title": "SEMICON-DRA DRAM Cycle Trough Recovery Thesis",
  "slug": "semicon-dra",
  "canonical_url": "https://barneywohl.github.io/korea-research-map-agents/agentpress/examples/semicon-dra/",
  "summary_for_agents": "Verify whether DRAM price, HBM mix, OEM inventory, and China capacity evidence support or kill the DRAM cycle trough recovery thesis.",
  "human_summary": "# SEMICON-DRA DRAM Cycle Trough Recovery Thesis  Ticker/thesis-led AgentPress article for testing whether DRAM spot prices can recover as HBM demand absorbs legacy capacity and OEM inventory normalizes. Research commentary only; not investment advice.  ## Thesis  DRAM spot prices recover `20–35%` from trough within 12 months if HBM demand absorbs legacy DRAM capacity and PC/server inventory destocking completes.  ## What must be true  1. HBM bit demand growth is above `60% YoY`. 2. Samsung and S",
  "domains": [
    "research_stress_test",
    "finance_research"
  ],
  "task_types": [
    "agent_native_article"
  ],
  "target_agent_families": [
    "research agents",
    "RAG systems",
    "eval harnesses",
    "crawler/indexing agents"
  ],
  "languages": [
    "en"
  ],
  "regions": [
    "global",
    "korea_stress_test"
  ],
  "claims": [
    {
      "claim_id": "semicon-dra-claim-001",
      "source_map_url": "source-map.json"
    },
    {
      "claim_id": "semicon-dra-claim-002",
      "source_map_url": "source-map.json"
    }
  ],
  "freshness": {
    "last_reviewed_at": "2026-05-02",
    "stale_zones": [
      "DRAM spot pricing",
      "HBM demand/capacity mix",
      "OEM/server inventory",
      "China capacity additions"
    ],
    "freshness_window_days": 14
  },
  "actions": {
    "allowed_actions_url": "allowed-actions.json",
    "allowed": [
      "read",
      "summarize",
      "cite",
      "transform",
      "benchmark",
      "open_issue",
      "create_pr"
    ],
    "requires_human_approval": [
      "external_post",
      "investment_recommendation",
      "private_data_access"
    ],
    "prohibited": [
      "deceptive_tracking",
      "impersonation",
      "spam",
      "bypass_paywall",
      "trading_recommendation"
    ]
  },
  "evals": [
    "evals/dram-smoke.jsonl",
    "evals/smoke.jsonl"
  ],
  "related_articles": [],
  "machine_entrypoints": {
    "task_card": "agent-task-card.json",
    "source_map": "source-map.json",
    "llms_txt": "llms.txt",
    "ai_ingestion": ".well-known/ai-ingestion.json",
    "article_card": "article-card.json"
  },
  "disclaimer": "Research commentary only. Not investment advice."
}
